{
  "schema_version": "1.0",
  "generated_at": "2026-05-24T02:00:00Z",
  "description": "Seed manifest for AICR Binder dashboard development. Entries use public OSN or GitHub-hosted artifacts and public study pages.",
  "artifacts": [
    {
      "id": "dataloader-b200-single-gpu-surface-2026-05-12",
      "title": "DataLoader single-GPU surface",
      "module": "dataloader",
      "study": "single-gpu-surface",
      "cluster": "mixed",
      "date": "2026-05-12",
      "role": "canonical",
      "evidence_type": "input-throughput",
      "artifact_type": "summary-csv",
      "format": "csv",
      "url": "https://uma1.osn.mghpcc.org/csim-bmark/public-study-artifacts/aicr-public/9d4402f/dataloader/2026-05-12/single-gpu-surface/dataloader-single-gpu-surface.csv",
      "public_page": "https://github.com/ohpcsim/aicr-public/blob/main/Cambridge/aicr-bench/docs/modules/dataloader/studies/b200-single-gpu-surface.md",
      "commit": "9d4402f",
      "metrics": ["samples_per_second"]
    },
    {
      "id": "dataloader-b200-multinode-scale-2026-05-14",
      "title": "B200 DataLoader scale probe",
      "module": "dataloader",
      "study": "b200-multinode-scale-probe",
      "cluster": "b200",
      "date": "2026-05-14",
      "role": "canonical",
      "evidence_type": "input-throughput",
      "artifact_type": "aggregate-csv",
      "format": "csv",
      "url": "https://uma1.osn.mghpcc.org/csim-bmark/public-study-artifacts/aicr-public/bbcc5f7/dataloader/2026-05-14/dataloader-b200-2-4-8-16-scale-probe-2026-05-14/reports/dataloader-b200-scale-probe-aggregated-2026-05-14.csv",
      "public_page": "https://github.com/ohpcsim/aicr-public/blob/main/Cambridge/aicr-bench/docs/modules/dataloader/studies/b200-multinode-scale-probe.md",
      "commit": "bbcc5f7",
      "metrics": ["samples_per_second", "rank_imbalance"]
    },
    {
      "id": "dataloader-rtx-multinode-scale-2026-05-13",
      "title": "RTX DataLoader scale probe",
      "module": "dataloader",
      "study": "rtx-multinode-scale-probe",
      "cluster": "rtxpro6000",
      "date": "2026-05-13",
      "role": "canonical",
      "evidence_type": "input-throughput",
      "artifact_type": "aggregate-csv",
      "format": "csv",
      "url": "https://uma1.osn.mghpcc.org/csim-bmark/public-study-artifacts/aicr-public/c54a4b2/dataloader/2026-05-13/dataloader-rtx-8node-scale-probe-2026-05-13/reports/dataloader-rtx-8node-aggregated-2026-05-13.csv",
      "public_page": "https://github.com/ohpcsim/aicr-public/blob/main/Cambridge/aicr-bench/docs/modules/dataloader/studies/rtx-multinode-scale-probe.md",
      "commit": "c54a4b2",
      "metrics": ["samples_per_second", "rank_imbalance"]
    },
    {
      "id": "dataloader-backend-dali-crossover-2026-05-23",
      "title": "DataLoader backend DALI crossover",
      "module": "dataloader",
      "study": "backend-dali-crossover",
      "cluster": "mixed",
      "date": "2026-05-23",
      "role": "supporting",
      "evidence_type": "backend-crossover",
      "artifact_type": "provenance-json",
      "format": "json",
      "url": "https://uma1.osn.mghpcc.org/csim-bmark/public-study-artifacts/aicr-public/e4f0664/dataloader/2026-05-23/dataloader-backend-dali-crossover-100x500-2026-05-23-provenance.json",
      "public_page": "https://github.com/ohpcsim/aicr-public/blob/main/Cambridge/aicr-bench/docs/modules/dataloader/studies/backend-dali-crossover.md",
      "commit": "e4f0664",
      "metrics": ["samples_per_second", "dali_cpu_ratio"]
    },
    {
      "id": "ddp-training-validation-2026-05-23",
      "title": "DDP DataLoader candidate follow-up",
      "module": "ddp",
      "study": "dataloader-candidate-followup",
      "cluster": "mixed",
      "date": "2026-05-23",
      "role": "canonical",
      "evidence_type": "training-throughput",
      "artifact_type": "provenance-json",
      "format": "json",
      "url": "https://uma1.osn.mghpcc.org/csim-bmark/public-study-artifacts/aicr-public/ee8c84f/ddp/training-validation-100x500/ddp-training-validation-100x500-provenance.json",
      "public_page": "https://github.com/ohpcsim/aicr-public/blob/main/Cambridge/aicr-bench/docs/modules/ddp/studies/dataloader-candidate-followup.md",
      "commit": "ee8c84f",
      "metrics": ["images_per_second", "input_wait_ms"]
    },
    {
      "id": "ddp-multinode-scale-validation-2026-05-23",
      "title": "DDP multi-node scale validation",
      "module": "ddp",
      "study": "multinode-scale-validation",
      "cluster": "mixed",
      "date": "2026-05-23",
      "role": "canonical",
      "evidence_type": "training-throughput",
      "artifact_type": "provenance-json",
      "format": "json",
      "url": "https://uma1.osn.mghpcc.org/csim-bmark/public-study-artifacts/aicr-public/f798897/ddp/multinode-scale-validation-100x500/provenance.json",
      "public_page": "https://github.com/ohpcsim/aicr-public/blob/main/Cambridge/aicr-bench/docs/modules/ddp/studies/multinode-scale-validation.md",
      "commit": "f798897",
      "metrics": ["images_per_second", "scaling_efficiency"]
    },
    {
      "id": "nccl-b200-rtx-rdma-ladder-2026-05-12",
      "title": "NCCL B200/RTX clean-prefix RDMA ladder",
      "module": "nccl",
      "study": "rdma-ladder",
      "cluster": "mixed",
      "date": "2026-05-12",
      "role": "campaign",
      "evidence_type": "communication-throughput",
      "artifact_type": "provenance-json",
      "format": "json",
      "url": "https://uma1.osn.mghpcc.org/csim-bmark/public-study-artifacts/aicr-public/b01c7cc/nccl/2026-05-12/nccl-b200-rtx-clean-prefix-rdma-results-olympic-2026-05-12-provenance.json",
      "public_page": "https://github.com/ohpcsim/aicr-public/blob/main/Cambridge/aicr-bench/docs/modules/nccl/studies/rtx-rdma-ladder.md",
      "commit": "b01c7cc",
      "metrics": ["bus_bandwidth", "algorithm_bandwidth"]
    },
    {
      "id": "gds-rtx-focused-fleet-2026-05-23",
      "title": "RTX GDS focused serial fleet",
      "module": "gds",
      "study": "rtx-focused-serial-fleet-olympic",
      "cluster": "rtxpro6000",
      "date": "2026-05-23",
      "role": "campaign",
      "evidence_type": "storage-throughput",
      "artifact_type": "provenance-json",
      "format": "json",
      "url": "https://uma1.osn.mghpcc.org/csim-bmark/public-study-artifacts/aicr-public/22cf1a9/gds/2026-05-23/gds-rtx-focused-serial-fleet-olympic-2026-05-23.provenance.json",
      "public_page": "https://github.com/ohpcsim/aicr-public/blob/main/Cambridge/aicr-bench/docs/modules/gds/studies/rtx-focused-serial-fleet-olympic.md",
      "commit": "22cf1a9",
      "metrics": ["read_gib_per_second"]
    },
    {
      "id": "hpl-mxp-module-study-index-2026-05-24",
      "title": "HPL-MxP module study index",
      "module": "hpl-mxp",
      "study": "module-study-index",
      "cluster": "mixed",
      "date": "2026-05-24",
      "role": "planned",
      "evidence_type": "module-study-index",
      "artifact_type": "study-page",
      "format": "markdown",
      "url": "https://github.com/ohpcsim/aicr-public/blob/main/Cambridge/aicr-bench/docs/modules/hpl-mxp/studies.md",
      "public_page": "https://github.com/ohpcsim/aicr-public/blob/main/Cambridge/aicr-bench/docs/modules/hpl-mxp/studies.md",
      "notes": "Results-backed HPL-MxP dashboard entries should be added after the public study pages and artifact links are finalized.",
      "metrics": ["tflops", "residual_status"]
    },
    {
      "id": "hpcg-planned-smoke-ladder-2026-05-24",
      "title": "HPCG diagnostic smoke ladder",
      "module": "hpcg",
      "study": "planned-smoke-ladder",
      "cluster": "mixed",
      "date": "2026-05-24",
      "role": "planned",
      "evidence_type": "planned-diagnostic",
      "artifact_type": "study-page",
      "format": "markdown",
      "url": "https://github.com/ohpcsim/aicr-public/blob/main/Cambridge/aicr-bench/docs/modules/hpcg/studies.md",
      "public_page": "https://github.com/ohpcsim/aicr-public/blob/main/Cambridge/aicr-bench/docs/modules/hpcg/studies.md",
      "notes": "HPCG entries remain planned until AICR-owned rows have complete artifacts and validity evidence.",
      "metrics": ["hpcg_gflops", "validity"]
    }
  ]
}
